{
	"name": "Share Tech Mono",
	"author": "Ralph du Carrois",
	"year": 2012,
	"license": "SIL OFL",
	"websites": [
		"http://www.google.com/fonts/specimen/Share+Tech+Mono",
		"http://www.fontsquirrel.com/fonts/Share-Regular"
	],
	"free": "open license",
	"serif": false,
	"tags": [
		"professional"
	]
}
