{
	"name": "Audimat Mono",
	"author": "SMeltery",
	"year": 2008,
	"license": "requires permission",
	"websites": [
		"http://www.fontsquirrel.com/fonts/Audimat-Mono",
		"http://www.smeltery.net/fonts/audimat-mono"
	],
	"free": "free for personal use",
	"serif": false,
	"tags": [
		"professional"
	]
}
