{
	"name": "Cutive Mono",
	"author": "Vernon Adams",
	"year": 2012,
	"license": "SIL OFL",
	"websites": [
		"http://www.google.com/fonts/specimen/Cutive+Mono",
		"https://github.com/vernnobile/CutiveFont",
		"http://luc.devroye.org/fonts-47641.html"
	],
	"serif": true,
	"free": "open license",
	"tags": [
		"typewriter",
		"github",
		"open source",
		"professional"
	]
}
