{
	"name": "Anonymous Pro",
	"author": "Mark Simonson",
	"year": 2009,
	"license": "SIL OFL",
	"websites": [
		"http://www.marksimonson.com/fonts/view/anonymous-pro",
		"http://www.fontsquirrel.com/fonts/Anonymous-Pro",
		"http://www.google.com/fonts/specimen/Anonymous+Pro"
	],
	"serif": false,
	"free": "open license",
	"tags": [
		"professional"
	]
}
